都道府県コード又は市区町村コード,NO,都道府県名,市区町村名,名称,名称_カナ,名称_英語,POIコード,住所,方書,緯度,経度,利用可能曜日,開始時間,終了時間,利用可能日時特記事項,料金（基本）,料金（詳細）,説明,説明_英語,アクセス方法,駐車場情報,バリアフリー情報,連絡先名称,連絡先電話番号,連絡先内線番号,画像,画像_ライセンス,URL,備考,区分1,区分2,休業日,最大収容人数,バリアフリー対応,身障者用駐車場有り,車イスでの入店可能,車イストイレあり,多目的トイレあり,バリアフリーその他,バリアフリー詳細情報_他_備考,HP有無,焼津温泉,宿泊施設_部屋数,宿泊施設_温泉,タグ1,タグ2,タグ3,ふるさと納税
222127,2026000188,静岡県,焼津市,ホテルアンビア松風閣,ホテルアンビアショウフウカク,,,静岡県焼津市浜当目海岸通り星が丘,,34.884753,138.337298,,,,,,"標準　24,400円～",富士山と駿河湾一望のおもてなし！自慢の絶景と海の幸をお楽しみください。※日帰り入浴,,,普150台/大型20台,,,054-628-3131,,,,https://www.syofukaku.com/,,宿泊,観光ホテル,,,有,〇,〇,〇,〇,,対応している客室、トイレ、スロープ有り。,有,,114室　402名様収容,1,,,,
222127,2026000189,静岡県,焼津市,焼津グランドホテル,ヤイヅグランドホテル,,,静岡県焼津市浜当目1489,,34.883258,138.337117,,,,予約センター　9:30～18:00,,"1泊2食付き　海側洋室 1名様料金 (2名様1室利用時) 29,900円～",駿河湾と富士山を一望。アクティビティなどのコンテンツが充実したオールインクルーシブ・リゾート。　※日帰り入浴,,,普100台/大型要相談,,,054-627-1121,,,,https://www.sn-hotels.com/ygh/,,宿泊,観光ホテル,,,有,〇,〇,〇,〇,,スロープ、多目的トイレ３ヶ所、大浴場にシャワーチェア有り。,有,,137室450名様収容,1,,,,
222127,2026000190,静岡県,焼津市,亀の井ホテル焼津,カメノイホテルヤイヅ,,,静岡県焼津市浜当目1375-2,,34.883084,138.333097,,,,,,"T１泊２食付13,130円～",駿河湾を見下ろす高台の温泉ホテル。2025年7月リニューアルオープン。レストラン、ロビーがリニューアル。キッズパークも誕生。※日帰り入浴,,,普66台,,,054-627-0661,,,,https://kamenoi-hotels.com/yaizu/,,宿泊,観光ホテル,,,有,〇,〇,〇,,,,有,,53室（露天風呂付特別和洋5・和洋2・洋28・和18）196名様収容,1,,,,
222127,2026000191,静岡県,焼津市,ホテルテトラリゾート静岡やいづ,ホテルテトラリゾートシズオカヤイヅ,,,静岡県焼津市田尻北1631-5,,34.83520919,138.3357859,,,,,,"1泊2食付12,000円～　1泊朝食付9,000円～　素泊まり7,000円～　　",小宴会場、大浴場、プール、BBQコーナー併設！素敵な休日をお約束します。富士山と駿河湾の眺めが自慢です！　　※日帰り入浴,,,普50台/大型3台,,,054-624-3308,,,,https://yaizu.e-tetora.com/,,宿泊,観光ホテル,,,有,〇,〇,〇,,,,有,,41室150名様収容,,,,,
222127,2026000192,静岡県,焼津市,くれたけイン焼津駅前,クレタケインヤイヅエキマエ,,,静岡県焼津市駅北1-2-2,,34.873119,138.318288,,,,,,"１泊朝食付7,700円～　※男女別浴場利用時　別途入湯税がかかります",焼津駅北口から30秒♪自慢は無料朝食バイキングと男女別浴場。笑顔で皆様をお迎え致します。　※日帰り入浴,,,普50台/大型　要相談,,,054-620-0011,,,,http://www.kuretake-inn.com/yaiz/,,宿泊,ビジネスホテル,,,有,〇,〇,〇,,,身障者用のお部屋あり（１室）（広め、お風呂も入れる）,有,,117室　　125名様収容,1,,,,
222127,2026000193,静岡県,焼津市,ホテルセレクトイン焼津駅前,ホテルセレクトインヤイヅエキマエ,,,静岡県焼津市栄町2-3-5,,34.871375,138.319709,,,,,,"1泊S5,200円～（日によって変動有）",笑顔溢れるセレクトインへ是非お越しください。,,,普23台,,,054-627-3436,,,,https://select-hotels.jp/yaizu/,,宿泊,ビジネスホテル,,,無,,,,,,,有,,37室　最大72名様収容,,,,,
222127,2026000194,静岡県,焼津市,ホテルシーラックパル焼津,ホテルシーラックパルヤイヅ,,,静岡県焼津市栄町2-6-17,,34.871347,138.321266,,,,,,"1泊朝食付Ｓ6,930円、D9,790円、Ｔ10,890円",焼津駅徒歩3分。無料平面駐車場完備。全館全室Wｉ-Fｉ完備。ＶＯＤ無料視聴。お客様ご自身のスマホで漫画・雑誌無料で見放題。,,,普64台,,,054-620-5586,,,,https://www.sealuckpal.co.jp/yaizu/,,宿泊,ビジネスホテル,,,無,,,,,,,有,,108室（うちツイン15室・ダブル18室利用可）,,,,,
222127,2026000195,静岡県,焼津市,HOTEL nanvan焼津,ホテルナンバンヤイヅ,,,静岡県焼津市越後島360-3,,34.885201,138.296755,,,,,,"１泊（無料朝食付）S7,700円～D13,000円～T16,000円～　",東名焼津ICより1分・新東名藤枝岡部ICより7分　朝食無料（まぐろの漬けが食べ放題）,,,普125台/中型以上は要予約　ホテル⇔焼津駅間無料送迎あり（要予約）,,,054-628-8835,,,,https://www.nanvan.jp/,,宿泊,ビジネスホテル,,,有,〇,,〇,,,,有,,154室全室有線LAN 無線LAN無料接続対応,,,,,
222127,2026000196,静岡県,焼津市,ホテルルートイン焼津インター,ホテルルートインヤイヅインター,,,焼津市八楠1-27-7,,34.881928,138.3026396,,,,,,"1泊朝食付　?7,200円～ ?12,800円～",東名高速 焼津IC目の前！無料駐車場完備 ※先着順・朝食無料サービス・大浴場あり・ＷＯＷＯＷ全室で無料視聴可,,,普119台/大型要相談,,,054-671-0001,,,,https://www.route-inn.co.jp/,,宿泊,ビジネスホテル,,,無,,,,,,,有,,135室200名様収容,,,,,
222127,2026000197,静岡県,焼津市,西焼津セントラルホテル,ニシヤイヅセントラルホテル,,,静岡県焼津市柳新屋858,,34.85787,138.290313,,,,,,"1泊朝食付き?4,900円 ?8,000円　",365日同一料金　駐車場（大型含）・洗濯機・乾燥機無料。西焼津駅周辺唯一のビジネスホテルです。,,,普60台/大型車（4トン）7台,,,054-626-2222,,,,http://www.nishiyaizu.com/,,宿泊,ビジネスホテル,,,無,,,,,,,有,,98室（洋98）102名様収容,,,,,
222127,2026000198,静岡県,焼津市,湊（みなと）のやど汀家（みぎわや）,ミナトノヤドミギワヤ,,,静岡県焼津市本町1-14-2,,34.868176,138.324766,,,,,,"1泊2食付（2名1室）1名様35,000円～48,000円　入湯税別途1人150円",海辺の露天風呂付客室の小宿。どこか懐かしく温かい居心地のよい宿で癒しのひとときをお過ごしください。,,,普10台/大型1台,,,054-628-3155,,,,http://www.migiwaya.jp/,,宿泊,旅館,,,有,〇,〇,,〇,,車イス対応の部屋有り。床フラット。手すり有り。２階にもエレベターで行ける。,有,,8室（和洋8）32名様収容,1,,,,
222127,2026000199,静岡県,焼津市,月と鮪 石上,ツキトマグロイシガミ,,,静岡県焼津市小浜1047,,34.895148,138.345527,,,,9：00～11：00　　15：00～21：00,,"1泊2食付35,500円～",2022年7月リニューアルオープン。ゆったりとたゆたう月のように流れる贅沢な時間と極上南鮪のフルコースをお愉しみ下さい。,,,普8台,,,054-627-1636,,,,https://www.magurono-oyado-ishigami.net/,,宿泊,旅館,不定休,,無,,,,,,,有,,5室（和洋）10名様収容,1,,,,
222127,2026000200,静岡県,焼津市,土筆旅館,ツクシリョカン,,,静岡県焼津市栄町1-11-10,,34.870557,138.316513,,,,,,"1泊朝食付6,820円～、　1泊2食付9,570円～",焼津駅より徒歩5分。地魚料理が自慢。ワーケーション・ビジネス・ゼミ・スポーツ合宿に最適。,,,普10台/大型2台,,,054-627-7378,,,,https://tukusiryokan.com/,,宿泊,旅館,,,有,〇,〇,,,,館内の段差を少なくしている。手すり有り。必要な方には折りたたみベット対応可。詳細は直接お問い合わせください。,有,,12室（和12）30名様収容,,,,,
222127,2026000201,静岡県,焼津市,ビジネスホテル　翠峰,ビジネスホテルスイホウ,,,静岡県焼津市上小杉310-1,,34.81472,138.280294,,,,,,"素泊まり5,500円～、1泊2食付8,250円",東名大井川焼津藤枝スマートICより5分。ビジネス・スポーツ・ご家族連れ。焼津港・大井川港 地元でとれた新鮮な海の幸、山の幸を 四季折々の日替わりメニューでおもてなしを。,,,普8台/大型1台,,,054-622-0028,,,,http://suiho.info/,FAX　054-622-1955,宿泊,旅館,,,無,,,,,,,有,,10室（和9・洋1）　35名様収容,,,,,
222127,2026000202,静岡県,焼津市,ビジネスホテル大井川,ビジネスホテルオオイガワ,,,静岡県焼津市中島452-1,,34.791629,138.27688,,,,,,"S5,500円（1泊無料朝食サービス）夕食は1,500円",アットホームな雰囲気でおもてなし。全室Wi-Fi完備。駐車場無料（大型車可）。コインランドリーあります。,,,普10台/大型2台,,,080-5100-2445,,,,https://bhoigawa.com/,,宿泊,旅館,,,無,,,,,,,有,,16室16名様収容（合宿等の場合は応相談）,,,,,
222127,2026000203,静岡県,焼津市,民宿　お食事処　柳亭,ミンシュクオショクジドコロヤナギテイ,,,静岡県焼津市浜当目2-19-25,,34.876228,138.33101,,,,,,"1泊2食付10,200円～",海水浴場手前。駿河湾から望む朝日が絶景。新鮮な海の幸を楽しみながらくつろげる静かな宿。,,,普7台/大型要相談,,,054-671-1300,,,,http://park6.wakwak.com/~yanagitei/,,宿泊,民宿,,,無,,,,,,,有,,2室（和2）10名様収容,,,,,
222127,2026000204,静岡県,焼津市,CRAFTHOTEL 西町　DOCK,クラフトホテルニシマチドック,,,静岡県焼津市駅北2-8-9,,34.8724648,138.3157379,,,,,,"S3,300円～　D6,050円～　T7,150円～",ゲストハウス風のホテルです！個室やドーミトリーを素泊まりでご提供し、まちの飲食店など紹介しています。,,,普2台,,,050-8893-8582,,,,https://www.instagram.com/hotel.yaizu/,,宿泊,民宿,,,無,,,,,,,有,,9室20名様収容,,,,,
222127,2026000205,静岡県,焼津市,焼津船員保険保養所　やいづマリンパレス,ヤイヅセンインホケンホヨウジョヤイヅマリンパレス,,,静岡県焼津市本町1-6-3,,34.870074,138.322398,,,,,,"9,900円～",天然温泉、宴会場、舟盛、鮪カブト焼など海鮮料理。,,,普15台,,,054-629-1011,,,,https://www.sempos.or.jp/yaizu/,,宿泊,公共,,,無,,,,,,,有,,28室（和19・洋3・和洋6）93名様収容,1,,,,
222127,2026000206,静岡県,焼津市,bo-kaap YAIZU,ボカープヤイヅ,,,静岡県焼津市本町1-5-15,,34.8695184,138.3231059,,,,,,"１棟貸切 19,900円~（ご宿泊人数、時期によって料金が変動します）",南アフリカのケープタウンにあるカラフルな街並みが特徴の港町「bo-kaap」をイメージした貸別荘。心おどる室内と可愛らしい雑貨を楽しめます。,,,普1台,,,なし,,,,https://bo-kaap-yaizu.com,Mail:bo-kaap_yaizu@bonitojapan.com,宿泊,一棟貸施設,,,無,,,,,,,有,,4LDK　8名まで（8名以上は要相談）,,,,,
222127,2026000207,静岡県,焼津市,焼津ハウスホテル,ヤイヅハウスホテル,,,静岡県焼津市本町4-8-28,,34.864222,138.320595,,,,,,"１棟28,000円～　Airbnb、じゃらんにて御予約承り中",別荘風ホテル。長期滞在、大人数向けです。ご家族、グループ旅行、帰省などでもご利用ください。炊飯、自炊可能です。洗濯機、乾燥機ございます。,,,普2台,,,090-1208-1708,,,,https://yaizuhousehotel.com/,,宿泊,一棟貸施設,,,無,,,,,,,有,,ダイニングキッチン1、1階奥和室ダブルベッド2台2名様、1階手前　和室布団3組3名様、2階洋室ベッド3名様　最大8名様宿泊可能。トイレ2、お風呂1,,,,,
222127,2026000208,静岡県,焼津市,ゐらくさ,ヰラクサ,,,静岡県焼津市大村2-23‐1,,34.8704289,138.30995,,,,,,詳しくはHPをご覧ください。,2026年オープン。古民家一棟貸し宿。土間のある空間で自由に滞在。信楽焼の陶器風呂で贅沢な時間をごゆるりと。,,,,,,090-9269-3973,,,,http://irakusa-yaizu.com,,宿泊,一棟貸施設,,,無,,,,,,,有,,1室5名様収容,,,,,
222127,2026000209,静岡県,焼津市,庭の宿『帆や』～hoya～,ニワノヤドホヤ,,,静岡県焼津市城之腰119‐1,,34.861845,138.323886,,,,,,"1名16,500円～・4名以上66,000円～Airbnbにて御予約承り中",焼津水産業発展に寄与した服部安次郎生家をリノベーションした施設。レンタルスペース・宿泊等多様にご利用いただけます。,,,普2台,,,054-624-1355,,,,https://niwayado.com/,,宿泊,一棟貸施設,,,有,,○,,,,,有,,5室（和5）10名様収容（10名以上の場合要相談）,,,,,
